{
  "$schema": "http://json-schema.org/draft-07/schema#",
  "title": "Legion Settings",
  "type": "object",
  "additionalProperties": false,
  "properties": {
    "$schema": { "type": "string" },
    "control_mode": {
      "type": "string",
      "enum": ["autonomous", "guarded", "advisory", "surgical"],
      "default": "guarded",
      "description": "Controls how strictly authority matrix rules are enforced. See .planning/config/control-modes.yaml for flag profiles."
    },
    "models": {
      "type": "object",
      "additionalProperties": false,
      "properties": {
        "planning": { "type": "string" },
        "execution": { "type": "string" },
        "check": { "type": "string" },
        "planning_reasoning": {
          "type": "boolean",
          "default": false,
          "x-deprecated": true,
          "description": "DEPRECATED — see docs/audits/2026-04-16-legion-4-7/proposals/phase-d-deprecate-planning-reasoning.md. Slated for removal in v8.0."
        }
      },
      "required": ["planning", "execution", "check"]
    },
    "planning": {
      "type": "object",
      "additionalProperties": false,
      "properties": {
        "max_tasks_per_plan": { "type": "integer", "minimum": 1, "maximum": 5 },
        "architecture_proposals_default": { "type": "string", "enum": ["always", "prompt", "never"] },
        "spec_pipeline_default": { "type": "string", "enum": ["always", "prompt", "never"] }
      },
      "required": ["max_tasks_per_plan", "architecture_proposals_default", "spec_pipeline_default"]
    },
    "execution": {
      "type": "object",
      "additionalProperties": false,
      "properties": {
        "auto_commit": { "type": "boolean" },
        "commit_prefix": { "type": "string", "minLength": 1 },
        "agent_personality_verbosity": { "type": "string", "enum": ["full", "condensed"] },
        "use_worktrees": {
          "type": "boolean",
          "default": false,
          "description": "EXPERIMENTAL — opt-in worktree isolation per plan. See skills/wave-executor/SKILL.md for behavior. Defaults to false; flip only after running scripts/worktree-doctor.js (forthcoming, separate spec)."
        }
      },
      "required": ["auto_commit", "commit_prefix", "agent_personality_verbosity"]
    },
    "review": {
      "type": "object",
      "additionalProperties": false,
      "properties": {
        "default_mode": { "type": "string", "enum": ["classic", "panel"] },
        "max_cycles": { "type": "integer", "minimum": 1, "maximum": 5 },
        "evaluator_depth": {
          "type": "string",
          "enum": ["single", "multi-pass"],
          "default": "multi-pass"
        },
        "polish": {
          "type": "boolean",
          "default": true,
          "description": "Enable post-review code polish step. When true, /legion:review runs a 4-pass cleanup after review passes."
        },
        "polish_scope": {
          "type": "string",
          "enum": ["changed", "dependents", "directory"],
          "default": "dependents",
          "description": "Scope for review-integrated polish: changed files only, changed + dependents (default), or full directory."
        },
        "coverage_thresholds": {
          "type": "object",
          "additionalProperties": false,
          "properties": {
            "overall": { "type": "integer", "minimum": 0, "maximum": 100 },
            "business_logic": { "type": "integer", "minimum": 0, "maximum": 100 },
            "api_routes": { "type": "integer", "minimum": 0, "maximum": 100 }
          }
        }
      },
      "required": ["default_mode", "max_cycles"]
    },
    "board": {
      "type": "object",
      "additionalProperties": false,
      "properties": {
        "default_size": { "type": "integer", "minimum": 2, "maximum": 7 },
        "min_size": { "type": "integer", "minimum": 2, "maximum": 5 },
        "discussion_rounds": { "type": "integer", "minimum": 1, "maximum": 5 },
        "assessment_timeout_ms": { "type": "integer", "minimum": 30000 },
        "persist_artifacts": { "type": "boolean" }
      },
      "required": ["default_size", "min_size", "discussion_rounds", "assessment_timeout_ms", "persist_artifacts"]
    },
    "dispatch": {
      "type": "object",
      "additionalProperties": false,
      "properties": {
        "enabled": { "type": "boolean" },
        "fallback_to_internal": { "type": "boolean" },
        "timeout_ms": { "type": "integer", "minimum": 10000 },
        "max_retries": { "type": "integer", "minimum": 0, "maximum": 3 }
      },
      "required": ["enabled", "fallback_to_internal", "timeout_ms", "max_retries"]
    },
    "memory": {
      "type": "object",
      "additionalProperties": false,
      "properties": {
        "enabled": { "type": "boolean" },
        "project_scoped_only": { "type": "boolean", "const": true },
        "auto_prune": { "type": "boolean", "default": false },
        "prune_threshold": { "type": "integer", "minimum": 1, "default": 200 },
        "prune_age_days": { "type": "integer", "minimum": 1, "default": 90 }
      },
      "required": ["enabled", "project_scoped_only"]
    },
    "integrations": {
      "type": "object",
      "additionalProperties": false,
      "properties": {
        "github": { "type": "string", "enum": ["enabled", "disabled", "prompt"] }
      },
      "required": ["github"]
    }
  },
  "required": ["models", "planning", "execution", "review", "memory", "integrations", "dispatch"]
}
